{
  "cenario": "DT11",
  "modo": "IDEAL",
  "semente_referencia": 42,
  "requisitos": [
    "RF-SYN-01",
    "RNF-DES-01"
  ],
  "assercoes": [
    {
      "id": "A1",
      "nivel": "REQUISITO",
      "dado": "relógio saltou",
      "quando": "t = 200 s",
      "entao": {
        "tipo": "gemeo",
        "em_ms": 200000,
        "atualidade": "ATUAL",
        "ocupacao": "OCUPADA"
      }
    },
    {
      "id": "A2",
      "nivel": "REQUISITO",
      "dado": "relógio saltou",
      "quando": "o cenário termina",
      "entao": {
        "tipo": "metrica",
        "nome": "atualidade_gemeo_ms_p95",
        "max": 5000
      }
    },
    {
      "id": "A3",
      "nivel": "REQUISITO",
      "dado": "morador saiu",
      "quando": "t = 330 s",
      "entao": {
        "tipo": "gemeo",
        "em_ms": 330000,
        "atualidade": "ATUAL",
        "ocupacao": "VAZIA"
      }
    },
    {
      "id": "A4",
      "nivel": "REQUISITO",
      "dado": "relógio saltou",
      "quando": "eventos do hub",
      "entao": {
        "tipo": "relogio_nao_confiavel",
        "apos_ms": 120000
      }
    },
    {
      "id": "INV",
      "nivel": "REQUISITO",
      "dado": "qualquer execução",
      "quando": "o cenário termina",
      "entao": {
        "tipo": "invariantes"
      }
    }
  ]
}
